{
  "schema_version": "runtime_agent_manifest_v4",
  "runtime_agent_count": 28,
  "runtime_stage_count": 29,
  "default_cohort": "cohort_default",
  "private_knot_cohort_enablement": [
    {
      "cohort": "cohort_bull_2007",
      "enabled_agent_stages": [
        "china:agent_run",
        "us_economy:agent_run",
        "eu_economy:agent_run",
        "central_bank:agent_run",
        "us_financial_conditions:agent_run",
        "euro_area_financial_conditions:agent_run",
        "commodities:agent_run",
        "geopolitical:agent_run",
        "market_breadth:agent_run",
        "institutional_flow:agent_run",
        "semiconductor:agent_run",
        "technology:agent_run",
        "energy:agent_run",
        "biotech:agent_run",
        "consumer:agent_run",
        "industrials:agent_run",
        "real_estate_construction:agent_run",
        "financials:agent_run",
        "agriculture:agent_run",
        "relationship_mapper:agent_run",
        "druckenmiller:agent_run",
        "munger:agent_run",
        "burry:agent_run",
        "ackman:agent_run",
        "cro:cro_review",
        "alpha_discovery:alpha_discovery",
        "autonomous_execution:execution_feasibility",
        "cio:cio_proposal",
        "cio:cio_final"
      ],
      "bundled_fallback_agent_stages": []
    },
    {
      "cohort": "cohort_bull_2016",
      "enabled_agent_stages": [
        "china:agent_run",
        "us_economy:agent_run",
        "eu_economy:agent_run",
        "central_bank:agent_run",
        "us_financial_conditions:agent_run",
        "euro_area_financial_conditions:agent_run",
        "commodities:agent_run",
        "geopolitical:agent_run",
        "market_breadth:agent_run",
        "institutional_flow:agent_run",
        "semiconductor:agent_run",
        "technology:agent_run",
        "energy:agent_run",
        "biotech:agent_run",
        "consumer:agent_run",
        "industrials:agent_run",
        "real_estate_construction:agent_run",
        "financials:agent_run",
        "agriculture:agent_run",
        "relationship_mapper:agent_run",
        "druckenmiller:agent_run",
        "munger:agent_run",
        "burry:agent_run",
        "ackman:agent_run",
        "cro:cro_review",
        "alpha_discovery:alpha_discovery",
        "autonomous_execution:execution_feasibility",
        "cio:cio_proposal",
        "cio:cio_final"
      ],
      "bundled_fallback_agent_stages": []
    },
    {
      "cohort": "cohort_crisis_2008",
      "enabled_agent_stages": [
        "china:agent_run",
        "us_economy:agent_run",
        "eu_economy:agent_run",
        "central_bank:agent_run",
        "us_financial_conditions:agent_run",
        "euro_area_financial_conditions:agent_run",
        "commodities:agent_run",
        "geopolitical:agent_run",
        "market_breadth:agent_run",
        "institutional_flow:agent_run",
        "semiconductor:agent_run",
        "technology:agent_run",
        "energy:agent_run",
        "biotech:agent_run",
        "consumer:agent_run",
        "industrials:agent_run",
        "real_estate_construction:agent_run",
        "financials:agent_run",
        "agriculture:agent_run",
        "relationship_mapper:agent_run",
        "druckenmiller:agent_run",
        "munger:agent_run",
        "burry:agent_run",
        "ackman:agent_run",
        "cro:cro_review",
        "alpha_discovery:alpha_discovery",
        "autonomous_execution:execution_feasibility",
        "cio:cio_proposal",
        "cio:cio_final"
      ],
      "bundled_fallback_agent_stages": []
    },
    {
      "cohort": "cohort_crisis_covid",
      "enabled_agent_stages": [
        "china:agent_run",
        "us_economy:agent_run",
        "eu_economy:agent_run",
        "central_bank:agent_run",
        "us_financial_conditions:agent_run",
        "euro_area_financial_conditions:agent_run",
        "commodities:agent_run",
        "geopolitical:agent_run",
        "market_breadth:agent_run",
        "institutional_flow:agent_run",
        "semiconductor:agent_run",
        "technology:agent_run",
        "energy:agent_run",
        "biotech:agent_run",
        "consumer:agent_run",
        "industrials:agent_run",
        "real_estate_construction:agent_run",
        "financials:agent_run",
        "agriculture:agent_run",
        "relationship_mapper:agent_run",
        "druckenmiller:agent_run",
        "munger:agent_run",
        "burry:agent_run",
        "ackman:agent_run",
        "cro:cro_review",
        "alpha_discovery:alpha_discovery",
        "autonomous_execution:execution_feasibility",
        "cio:cio_proposal",
        "cio:cio_final"
      ],
      "bundled_fallback_agent_stages": []
    },
    {
      "cohort": "cohort_default",
      "enabled_agent_stages": [
        "china:agent_run",
        "us_economy:agent_run",
        "eu_economy:agent_run",
        "central_bank:agent_run",
        "us_financial_conditions:agent_run",
        "euro_area_financial_conditions:agent_run",
        "commodities:agent_run",
        "geopolitical:agent_run",
        "market_breadth:agent_run",
        "institutional_flow:agent_run",
        "semiconductor:agent_run",
        "technology:agent_run",
        "energy:agent_run",
        "biotech:agent_run",
        "consumer:agent_run",
        "industrials:agent_run",
        "real_estate_construction:agent_run",
        "financials:agent_run",
        "agriculture:agent_run",
        "relationship_mapper:agent_run",
        "druckenmiller:agent_run",
        "munger:agent_run",
        "burry:agent_run",
        "ackman:agent_run",
        "cro:cro_review",
        "alpha_discovery:alpha_discovery",
        "autonomous_execution:execution_feasibility",
        "cio:cio_proposal",
        "cio:cio_final"
      ],
      "bundled_fallback_agent_stages": []
    },
    {
      "cohort": "cohort_euphoria_2021",
      "enabled_agent_stages": [
        "china:agent_run",
        "us_economy:agent_run",
        "eu_economy:agent_run",
        "central_bank:agent_run",
        "us_financial_conditions:agent_run",
        "euro_area_financial_conditions:agent_run",
        "commodities:agent_run",
        "geopolitical:agent_run",
        "market_breadth:agent_run",
        "institutional_flow:agent_run",
        "semiconductor:agent_run",
        "technology:agent_run",
        "energy:agent_run",
        "biotech:agent_run",
        "consumer:agent_run",
        "industrials:agent_run",
        "real_estate_construction:agent_run",
        "financials:agent_run",
        "agriculture:agent_run",
        "relationship_mapper:agent_run",
        "druckenmiller:agent_run",
        "munger:agent_run",
        "burry:agent_run",
        "ackman:agent_run",
        "cro:cro_review",
        "alpha_discovery:alpha_discovery",
        "autonomous_execution:execution_feasibility",
        "cio:cio_proposal",
        "cio:cio_final"
      ],
      "bundled_fallback_agent_stages": []
    },
    {
      "cohort": "cohort_rate_tightening",
      "enabled_agent_stages": [
        "china:agent_run",
        "us_economy:agent_run",
        "eu_economy:agent_run",
        "central_bank:agent_run",
        "us_financial_conditions:agent_run",
        "euro_area_financial_conditions:agent_run",
        "commodities:agent_run",
        "geopolitical:agent_run",
        "market_breadth:agent_run",
        "institutional_flow:agent_run",
        "semiconductor:agent_run",
        "technology:agent_run",
        "energy:agent_run",
        "biotech:agent_run",
        "consumer:agent_run",
        "industrials:agent_run",
        "real_estate_construction:agent_run",
        "financials:agent_run",
        "agriculture:agent_run",
        "relationship_mapper:agent_run",
        "druckenmiller:agent_run",
        "munger:agent_run",
        "burry:agent_run",
        "ackman:agent_run",
        "cro:cro_review",
        "alpha_discovery:alpha_discovery",
        "autonomous_execution:execution_feasibility",
        "cio:cio_proposal",
        "cio:cio_final"
      ],
      "bundled_fallback_agent_stages": []
    },
    {
      "cohort": "cohort_recovery_2020",
      "enabled_agent_stages": [
        "china:agent_run",
        "us_economy:agent_run",
        "eu_economy:agent_run",
        "central_bank:agent_run",
        "us_financial_conditions:agent_run",
        "euro_area_financial_conditions:agent_run",
        "commodities:agent_run",
        "geopolitical:agent_run",
        "market_breadth:agent_run",
        "institutional_flow:agent_run",
        "semiconductor:agent_run",
        "technology:agent_run",
        "energy:agent_run",
        "biotech:agent_run",
        "consumer:agent_run",
        "industrials:agent_run",
        "real_estate_construction:agent_run",
        "financials:agent_run",
        "agriculture:agent_run",
        "relationship_mapper:agent_run",
        "druckenmiller:agent_run",
        "munger:agent_run",
        "burry:agent_run",
        "ackman:agent_run",
        "cro:cro_review",
        "alpha_discovery:alpha_discovery",
        "autonomous_execution:execution_feasibility",
        "cio:cio_proposal",
        "cio:cio_final"
      ],
      "bundled_fallback_agent_stages": []
    }
  ],
  "canonical_l4_sequence": [
    "alpha_discovery",
    "cio_proposal",
    "cro_review",
    "execution_feasibility",
    "cio_final"
  ],
  "knot_runtime_contract_ref": {
    "knot_runtime_contract_manifest_id": "knot-runtime-contract",
    "knot_runtime_contract_manifest_version": "knot_runtime_contract_manifest_v2",
    "knot_runtime_contract_manifest_hash": "sha256:a8f5b1108df82be7e05d036593c4bd0826193025bfbffbb1b56824097aaa9076",
    "private_runtime_manifest_hash": "sha256:91f368293da03a2db31dbb83557ef14c537ccb98aa5524aac57731ec245ce5cd",
    "research_score_contract_id": "knot-research-score",
    "research_score_contract_version": "knot_research_score_v2",